{
  "$schema": "https://json-schema.org/draft/2020-12/schema",
  "$id": "ir.schema.json",
  "title": "Intermediate Representation (IR)",
  "description": "Compiler intermediate representation: resolved symbols, types, and flow graph before state expansion. Produced by stlc --emit ir.",
  "type": "object",
  "properties": {
    "metadata": {
      "allOf": [
        {
          "$ref": "common/metadata.schema.json"
        },
        {
          "properties": {
            "format": {
              "const": "ir"
            }
          }
        }
      ],
      "unevaluatedProperties": false
    },
    "defines": {
      "type": "object",
      "description": "Compile-time defines (currently unused)."
    },
    "entry_points": {
      "type": "object",
      "description": "Entry point name to prompt name mapping.",
      "additionalProperties": {
        "type": "string"
      }
    },
    "prompts": {
      "type": "object",
      "description": "All prompts, keyed by mangled name.",
      "additionalProperties": {
        "$ref": "#/$defs/prompt"
      }
    },
    "records": {
      "type": "object",
      "description": "Named record type definitions."
    }
  },
  "required": [
    "defines",
    "entry_points",
    "prompts",
    "records"
  ],
  "unevaluatedProperties": false,
  "$defs": {
    "prompt": {
      "type": "object",
      "properties": {
        "name": {
          "type": "string"
        },
        "mangled_name": {
          "type": "string"
        },
        "desc": {
          "type": "array",
          "items": {
            "type": "string"
          }
        },
        "context": {
          "description": "Parameterization context (arbitrary key-value)."
        },
        "fields": {
          "type": "array",
          "items": {
            "$ref": "#/$defs/field"
          }
        },
        "flows": {
          "type": "array",
          "items": {
            "$ref": "#/$defs/flow"
          }
        },
        "channels": {
          "type": "array",
          "items": {
            "$ref": "#/$defs/channel"
          }
        },
        "return": {
          "$ref": "#/$defs/return_def"
        },
        "search": {
          "type": "object",
          "description": "Search params from `search { category.param is expr; }`. Intentionally OPEN (an experimentation surface): categories map to open param objects; values resolved/validated downstream at instantiation.",
          "additionalProperties": {
            "type": "object",
            "additionalProperties": {
              "type": [
                "number",
                "string",
                "boolean",
                "null"
              ]
            }
          }
        },
        "vocabs": {
          "$ref": "#/$defs/vocab_table"
        }
      },
      "required": [
        "name",
        "mangled_name",
        "desc",
        "fields",
        "flows",
        "channels",
        "return"
      ],
      "additionalProperties": false
    },
    "field": {
      "type": "object",
      "properties": {
        "name": {
          "type": "string"
        },
        "depth": {
          "type": "integer",
          "minimum": 0
        },
        "index": {
          "type": "integer",
          "minimum": 0
        },
        "desc": {
          "type": "array",
          "items": {
            "type": "string"
          }
        },
        "range": {
          "oneOf": [
            {
              "type": "array",
              "items": {
                "type": "integer"
              },
              "minItems": 1,
              "maxItems": 2
            },
            {
              "type": "null"
            }
          ]
        },
        "format": {
          "$ref": "#/$defs/field_format"
        },
        "refname": {
          "oneOf": [
            {
              "type": "string"
            },
            {
              "type": "null"
            }
          ]
        },
        "refargs": {
          "type": "object"
        },
        "search": {
          "$ref": "#/$defs/search_policy"
        }
      },
      "required": [
        "name",
        "depth",
        "index",
        "desc",
        "range",
        "format"
      ],
      "additionalProperties": false
    },
    "field_format": {
      "type": "object",
      "properties": {
        "type": {
          "type": "string",
          "enum": [
            "completion",
            "enum",
            "choice",
            "struct"
          ]
        },
        "length": {
          "type": "integer"
        },
        "values": {
          "type": "array",
          "items": {
            "type": "string"
          }
        },
        "mode": {
          "type": "string"
        },
        "path": {
          "$ref": "#/$defs/path_steps"
        },
        "fields": {
          "type": "array",
          "items": {
            "$ref": "#/$defs/field"
          }
        },
        "vocab": {
          "type": "string",
          "description": "Reference into the enclosing prompt/record vocab table (vocab_<hash>)."
        }
      },
      "required": [
        "type"
      ],
      "additionalProperties": false
    },
    "flow": {
      "type": "object",
      "properties": {
        "target": {
          "type": "string"
        },
        "label": {
          "oneOf": [
            {
              "type": "string"
            },
            {
              "type": "null"
            }
          ]
        },
        "limit": {
          "oneOf": [
            {
              "type": "integer"
            },
            {
              "type": "null"
            }
          ]
        }
      },
      "required": [
        "target",
        "label",
        "limit"
      ],
      "additionalProperties": false
    },
    "channel": {
      "type": "object",
      "properties": {
        "type": {
          "type": "string",
          "enum": [
            "input",
            "dataflow",
            "call"
          ]
        },
        "target": {
          "$ref": "#/$defs/data_ref"
        },
        "source": {
          "$ref": "#/$defs/path_steps"
        },
        "prompt": {
          "oneOf": [
            {
              "type": "string"
            },
            {
              "type": "null"
            }
          ]
        },
        "entry": {
          "oneOf": [
            {
              "type": "string"
            },
            {
              "type": "null"
            }
          ]
        },
        "extern": {
          "oneOf": [
            {
              "type": "string"
            },
            {
              "type": "null"
            }
          ]
        },
        "clauses": {
          "type": "array",
          "items": {
            "$ref": "#/$defs/clause"
          }
        },
        "kwargs": {
          "oneOf": [
            {
              "type": "object",
              "additionalProperties": {
                "$ref": "#/$defs/kwarg"
              }
            },
            {
              "type": "null"
            }
          ]
        },
        "link_clauses": {
          "type": "array",
          "items": {
            "$ref": "#/$defs/link_clause"
          }
        }
      },
      "required": [
        "type",
        "target"
      ],
      "additionalProperties": false
    },
    "data_ref": {
      "type": "object",
      "description": "Reference to a data location (field in a prompt frame).",
      "properties": {
        "is_input": {
          "type": "boolean"
        },
        "prompt": {
          "oneOf": [
            {
              "type": "string"
            },
            {
              "type": "null"
            }
          ]
        },
        "steps": {
          "$ref": "#/$defs/path_steps"
        }
      },
      "required": [
        "is_input",
        "steps"
      ],
      "additionalProperties": false
    },
    "path_steps": {
      "type": "array",
      "items": {
        "type": "object",
        "properties": {
          "name": {
            "type": "string"
          },
          "index": {
            "type": "integer",
            "description": "Index selector -> scalar element."
          },
          "slice": {
            "type": "array",
            "description": "Slice selector -> list. [lower, upper]; null = open bound.",
            "items": {
              "oneOf": [
                {
                  "type": "integer"
                },
                {
                  "type": "null"
                }
              ]
            },
            "minItems": 2,
            "maxItems": 2
          }
        },
        "required": [
          "name"
        ],
        "additionalProperties": false
      }
    },
    "kwarg": {
      "type": "object",
      "properties": {
        "is_input": {
          "type": "boolean"
        },
        "prompt": {
          "oneOf": [
            {
              "type": "string"
            },
            {
              "type": "null"
            }
          ]
        },
        "path": {
          "$ref": "#/$defs/path_steps"
        },
        "clauses": {
          "type": "array",
          "items": {
            "$ref": "#/$defs/clause"
          }
        }
      },
      "required": [
        "is_input",
        "path",
        "clauses"
      ],
      "additionalProperties": false
    },
    "clause": {
      "type": "object",
      "properties": {
        "type": {
          "type": "string"
        },
        "target": {
          "$ref": "#/$defs/path_steps"
        },
        "source": {
          "$ref": "#/$defs/path_steps"
        },
        "depth": {
          "type": "integer",
          "description": "Ravel flatten depth (omitted = default 1)."
        }
      },
      "required": [
        "type"
      ],
      "additionalProperties": false
    },
    "link_clause": {
      "type": "object",
      "properties": {
        "type": {
          "type": "string"
        },
        "source": {
          "$ref": "#/$defs/path_steps"
        },
        "target": {
          "$ref": "#/$defs/path_steps"
        },
        "depth": {
          "type": "integer",
          "description": "Ravel flatten depth (omitted = default 1)."
        }
      },
      "required": [
        "type",
        "target"
      ],
      "additionalProperties": false
    },
    "return_def": {
      "oneOf": [
        {
          "type": "object",
          "properties": {
            "label": {
              "oneOf": [
                {
                  "type": "string"
                },
                {
                  "type": "null"
                }
              ]
            },
            "fields": {
              "type": "array",
              "items": {
                "$ref": "#/$defs/return_field"
              }
            }
          },
          "required": [
            "label",
            "fields"
          ],
          "additionalProperties": false
        },
        {
          "type": "null"
        }
      ]
    },
    "return_field": {
      "type": "object",
      "properties": {
        "alias": {
          "oneOf": [
            {
              "type": "string"
            },
            {
              "type": "null"
            }
          ]
        },
        "clauses": {
          "type": "array",
          "items": {
            "$ref": "#/$defs/clause"
          }
        },
        "source": {
          "type": "object",
          "properties": {
            "is_input": {
              "type": "boolean"
            },
            "prompt": {
              "oneOf": [
                {
                  "type": "string"
                },
                {
                  "type": "null"
                }
              ]
            },
            "steps": {
              "$ref": "#/$defs/path_steps"
            }
          },
          "required": [
            "is_input",
            "prompt",
            "steps"
          ],
          "additionalProperties": false
        }
      },
      "required": [
        "alias",
        "clauses",
        "source"
      ],
      "additionalProperties": false
    },
    "search_policy": {
      "type": "object",
      "description": "Resolved search policy: category -> param -> scalar (OPEN).",
      "additionalProperties": {
        "type": "object",
        "additionalProperties": {
          "type": [
            "number",
            "integer",
            "string",
            "boolean",
            "null"
          ]
        }
      }
    },
    "vocab_table": {
      "type": "object",
      "description": "Vocab table: vocab_<hash> -> vocab expression tree.",
      "additionalProperties": {
        "$ref": "#/$defs/vocab_expr"
      }
    },
    "vocab_expr": {
      "type": "object",
      "description": "Vocab expression tree node.",
      "properties": {
        "kind": {
          "enum": [
            "tokenize",
            "regex",
            "union",
            "intersect",
            "diff",
            "complement"
          ]
        },
        "strings": {
          "type": "array",
          "items": {
            "type": "string"
          }
        },
        "operands": {
          "type": "array",
          "items": {
            "$ref": "#/$defs/vocab_expr"
          }
        }
      },
      "required": [
        "kind"
      ],
      "additionalProperties": false
    }
  }
}