{
  "defines": {},
  "entry_points": {
    "main": "main"
  },
  "prompts": {
    "main": {
      "channels": [
        {
          "entry": "processor",
          "extern": null,
          "kwargs": {
            "item": {
              "clauses": [
                {
                  "target": [],
                  "type": "mapped"
                }
              ],
              "is_input": true,
              "path": [
                {
                  "name": "items"
                }
              ],
              "prompt": null
            }
          },
          "link_clauses": [],
          "target": {
            "is_input": false,
            "prompt": null,
            "steps": [
              {
                "name": "results"
              }
            ]
          },
          "type": "call"
        }
      ],
      "context": {},
      "desc": [],
      "fields": [
        {
          "depth": 1,
          "desc": [],
          "format": {
            "length": 10,
            "type": "completion"
          },
          "index": 0,
          "name": "results",
          "range": [
            3
          ],
          "search": {
            "text": {
              "ahead": "__search__.text.ahead",
              "beams": "__search__.text.beams",
              "diversity": "__search__.text.diversity",
              "repetition": "__search__.text.repetition",
              "threshold": "__search__.text.threshold",
              "topk": "__search__.text.topk",
              "width": "__search__.text.width"
            }
          }
        },
        {
          "depth": 1,
          "desc": [],
          "format": {
            "length": 20,
            "type": "completion"
          },
          "index": 1,
          "name": "summary",
          "range": null,
          "search": {
            "text": {
              "ahead": "__search__.text.ahead",
              "beams": "__search__.text.beams",
              "diversity": "__search__.text.diversity",
              "repetition": "__search__.text.repetition",
              "threshold": "__search__.text.threshold",
              "topk": "__search__.text.topk",
              "width": "__search__.text.width"
            }
          }
        }
      ],
      "flows": [],
      "mangled_name": "main",
      "name": "main",
      "return": {
        "fields": [
          {
            "alias": null,
            "clauses": [],
            "source": {
              "is_input": false,
              "prompt": null,
              "steps": [
                {
                  "name": "summary"
                }
              ]
            }
          }
        ],
        "label": null
      },
      "search": {
        "queue": {
          "metric": "__search__.queue.metric",
          "stop": "__search__.queue.stop"
        }
      }
    },
    "processor": {
      "channels": [
        {
          "source": [
            {
              "name": "item"
            }
          ],
          "target": {
            "is_input": false,
            "prompt": null,
            "steps": [
              {
                "name": "item"
              }
            ]
          },
          "type": "input"
        }
      ],
      "context": {},
      "desc": [],
      "fields": [
        {
          "depth": 1,
          "desc": [],
          "format": {
            "length": 5,
            "type": "completion"
          },
          "index": 0,
          "name": "item",
          "range": null,
          "search": {
            "text": {
              "ahead": "__search__.text.ahead",
              "beams": "__search__.text.beams",
              "diversity": "__search__.text.diversity",
              "repetition": "__search__.text.repetition",
              "threshold": "__search__.text.threshold",
              "topk": "__search__.text.topk",
              "width": "__search__.text.width"
            }
          }
        },
        {
          "depth": 1,
          "desc": [],
          "format": {
            "length": 10,
            "type": "completion"
          },
          "index": 1,
          "name": "output",
          "range": null,
          "search": {
            "text": {
              "ahead": "__search__.text.ahead",
              "beams": "__search__.text.beams",
              "diversity": "__search__.text.diversity",
              "repetition": "__search__.text.repetition",
              "threshold": "__search__.text.threshold",
              "topk": "__search__.text.topk",
              "width": "__search__.text.width"
            }
          }
        }
      ],
      "flows": [],
      "mangled_name": "processor",
      "name": "processor",
      "return": {
        "fields": [
          {
            "alias": null,
            "clauses": [],
            "source": {
              "is_input": false,
              "prompt": null,
              "steps": [
                {
                  "name": "output"
                }
              ]
            }
          }
        ],
        "label": null
      },
      "search": {
        "queue": {
          "metric": "__search__.queue.metric",
          "stop": "__search__.queue.stop"
        }
      }
    }
  },
  "records": {}
}
