{
  "defines": {},
  "entry_points": {
    "main": "main"
  },
  "prompts": {
    "main": {
      "channels": [
        {
          "source": [
            {
              "name": "greeting"
            }
          ],
          "target": {
            "is_input": false,
            "prompt": null,
            "steps": [
              {
                "name": "greeting"
              }
            ]
          },
          "type": "input"
        },
        {
          "source": [
            {
              "name": "creative"
            }
          ],
          "target": {
            "is_input": false,
            "prompt": null,
            "steps": [
              {
                "name": "creative"
              }
            ]
          },
          "type": "input"
        }
      ],
      "context": {},
      "desc": [],
      "fields": [
        {
          "depth": 1,
          "desc": [],
          "format": {
            "length": 50,
            "type": "completion"
          },
          "index": 0,
          "name": "greeting",
          "range": null,
          "refname": "Message",
          "search": {
            "branch": {
              "width": 2
            },
            "enum": {
              "ranking.metric": "sum",
              "threshold.metric": "mean",
              "width": 3
            },
            "text": {
              "ahead": 2,
              "beams": 4,
              "threshold": 0.2
            }
          }
        },
        {
          "depth": 1,
          "desc": [],
          "format": {
            "length": 50,
            "type": "completion"
          },
          "index": 1,
          "name": "creative",
          "range": null,
          "refname": "SpecialText",
          "search": {
            "branch": {
              "threshold": 0.2,
              "width": 2
            },
            "enum": {
              "ranking.metric": "sum",
              "threshold.metric": "mean",
              "width": 3
            },
            "text": {
              "threshold": 0.2,
              "width": 1
            }
          }
        },
        {
          "depth": 1,
          "desc": [
            "extra detail block"
          ],
          "format": {
            "fields": [
              {
                "depth": 2,
                "desc": [],
                "format": {
                  "length": 30,
                  "type": "completion"
                },
                "index": 0,
                "name": "note",
                "range": null,
                "search": {
                  "branch": {
                    "width": 2
                  },
                  "enum": {
                    "ranking.metric": "sum",
                    "threshold.metric": "mean",
                    "width": 2
                  },
                  "text": {
                    "threshold": 0.3
                  }
                }
              },
              {
                "depth": 2,
                "desc": [],
                "format": {
                  "length": 20,
                  "type": "completion"
                },
                "index": 1,
                "name": "scored",
                "range": null,
                "search": {
                  "branch": {
                    "width": 2
                  },
                  "enum": {
                    "ranking.metric": "sum",
                    "threshold.metric": "mean",
                    "width": 2
                  },
                  "text": {
                    "beams": 2,
                    "threshold": 0.3
                  }
                }
              }
            ],
            "type": "struct"
          },
          "index": 2,
          "name": "details",
          "range": null,
          "search": {
            "branch": {
              "width": 2
            }
          }
        }
      ],
      "flows": [],
      "mangled_name": "main",
      "name": "main",
      "return": {
        "fields": [
          {
            "alias": null,
            "clauses": [],
            "source": {
              "is_input": false,
              "prompt": null,
              "steps": [
                {
                  "name": "greeting"
                }
              ]
            }
          },
          {
            "alias": null,
            "clauses": [],
            "source": {
              "is_input": false,
              "prompt": null,
              "steps": [
                {
                  "name": "creative"
                }
              ]
            }
          }
        ],
        "label": null
      },
      "search": {
        "flow": {
          "threshold": 0.05
        },
        "queue": {
          "metric": "probability"
        }
      }
    }
  },
  "records": {
    "Message": {
      "desc": [],
      "fields": [
        {
          "depth": 1,
          "desc": [],
          "format": {
            "length": 50,
            "type": "completion"
          },
          "index": 0,
          "name": "Message",
          "range": null
        }
      ],
      "name": "Message",
      "search": {
        "text": {
          "ahead": 2,
          "beams": 4
        }
      }
    },
    "SpecialText": {
      "desc": [],
      "fields": [
        {
          "depth": 1,
          "desc": [],
          "format": {
            "length": 50,
            "type": "completion"
          },
          "index": 0,
          "name": "SpecialText",
          "range": null
        }
      ],
      "name": "SpecialText",
      "search": {
        "branch": {
          "threshold": 0.2
        },
        "text": {
          "width": 1
        }
      }
    }
  }
}
