{
  "defines": {},
  "entry_points": {
    "main": "questioner"
  },
  "prompts": {
    "questioner": {
      "channels": [
        {
          "source": [
            {
              "name": "topic"
            }
          ],
          "target": {
            "is_input": false,
            "prompt": null,
            "steps": [
              {
                "name": "topic"
              }
            ]
          },
          "type": "input"
        }
      ],
      "context": {},
      "desc": [
        "You are answering yes/no questions."
      ],
      "fields": [
        {
          "depth": 1,
          "desc": [
            "The subject matter being discussed"
          ],
          "format": {
            "type": "completion"
          },
          "index": 0,
          "name": "topic",
          "range": null,
          "refname": "Topic",
          "search": {
            "text": {
              "ahead": "__search__.text.ahead",
              "beams": "__search__.text.beams",
              "diversity": "__search__.text.diversity",
              "repetition": "__search__.text.repetition",
              "threshold": "__search__.text.threshold",
              "topk": "__search__.text.topk",
              "width": "__search__.text.width"
            }
          }
        },
        {
          "depth": 1,
          "desc": [
            "the question to answer"
          ],
          "format": {
            "type": "completion"
          },
          "index": 1,
          "name": "question",
          "range": null,
          "search": {
            "text": {
              "ahead": "__search__.text.ahead",
              "beams": "__search__.text.beams",
              "diversity": "__search__.text.diversity",
              "repetition": "__search__.text.repetition",
              "threshold": "__search__.text.threshold",
              "topk": "__search__.text.topk",
              "width": "__search__.text.width"
            }
          }
        },
        {
          "depth": 1,
          "desc": [
            "your answer to the question"
          ],
          "format": {
            "type": "enum",
            "values": [
              "yes",
              "no",
              "maybe"
            ]
          },
          "index": 2,
          "name": "answer",
          "range": null,
          "search": {
            "enum": {
              "ranking.metric": "__search__.enum.ranking.metric",
              "threshold.metric": "__search__.enum.threshold.metric",
              "threshold.value": "__search__.enum.threshold.value",
              "width": "__search__.enum.width"
            }
          }
        }
      ],
      "flows": [],
      "mangled_name": "questioner",
      "name": "questioner",
      "return": {
        "fields": [
          {
            "alias": null,
            "clauses": [],
            "source": {
              "is_input": false,
              "prompt": null,
              "steps": [
                {
                  "name": "answer"
                }
              ]
            }
          }
        ],
        "label": null
      },
      "search": {
        "queue": {
          "metric": "__search__.queue.metric",
          "stop": "__search__.queue.stop"
        }
      }
    }
  },
  "records": {
    "Topic": {
      "desc": [
        "The subject matter being discussed"
      ],
      "fields": [
        {
          "depth": 1,
          "desc": [],
          "format": {
            "type": "completion"
          },
          "index": 0,
          "name": "Topic",
          "range": null
        }
      ],
      "name": "Topic"
    }
  }
}
