{
  "defines": {},
  "entry_points": {
    "main": "collector"
  },
  "prompts": {
    "collector": {
      "channels": [],
      "context": {},
      "desc": [],
      "fields": [
        {
          "depth": 1,
          "desc": [],
          "format": {
            "type": "completion"
          },
          "index": 0,
          "name": "fixed",
          "range": [
            5
          ],
          "refname": "Item",
          "search": {
            "text": {
              "ahead": "__search__.text.ahead",
              "beams": "__search__.text.beams",
              "diversity": "__search__.text.diversity",
              "repetition": "__search__.text.repetition",
              "threshold": "__search__.text.threshold",
              "topk": "__search__.text.topk",
              "width": "__search__.text.width"
            }
          }
        },
        {
          "depth": 1,
          "desc": [],
          "format": {
            "type": "completion"
          },
          "index": 1,
          "name": "ranged",
          "range": [
            2,
            8
          ],
          "search": {
            "text": {
              "ahead": "__search__.text.ahead",
              "beams": "__search__.text.beams",
              "diversity": "__search__.text.diversity",
              "repetition": "__search__.text.repetition",
              "threshold": "__search__.text.threshold",
              "topk": "__search__.text.topk",
              "width": "__search__.text.width"
            }
          }
        },
        {
          "depth": 1,
          "desc": [],
          "format": {
            "type": "enum",
            "values": [
              "a",
              "b",
              "c"
            ]
          },
          "index": 2,
          "name": "variable",
          "range": [
            1,
            10
          ],
          "search": {
            "enum": {
              "ranking.metric": "__search__.enum.ranking.metric",
              "threshold.metric": "__search__.enum.threshold.metric",
              "threshold.value": "__search__.enum.threshold.value",
              "width": "__search__.enum.width"
            }
          }
        }
      ],
      "flows": [],
      "mangled_name": "collector",
      "name": "collector",
      "return": {
        "fields": [
          {
            "alias": null,
            "clauses": [],
            "source": {
              "is_input": false,
              "prompt": null,
              "steps": [
                {
                  "name": "fixed"
                }
              ]
            }
          }
        ],
        "label": null
      },
      "search": {
        "queue": {
          "metric": "__search__.queue.metric",
          "stop": "__search__.queue.stop"
        }
      }
    }
  },
  "records": {
    "Item": {
      "desc": [],
      "fields": [
        {
          "depth": 1,
          "desc": [],
          "format": {
            "type": "completion"
          },
          "index": 0,
          "name": "Item",
          "range": null
        }
      ],
      "name": "Item"
    }
  }
}
