{
  "defines": {},
  "entry_points": {
    "main": "test"
  },
  "prompts": {
    "test": {
      "channels": [],
      "context": {},
      "desc": [],
      "fields": [
        {
          "depth": 1,
          "desc": [],
          "format": {
            "type": "enum",
            "values": [
              "pending",
              "active",
              "done"
            ]
          },
          "index": 0,
          "name": "status",
          "range": null,
          "refname": "Status",
          "search": {
            "enum": {
              "ranking.metric": "__search__.enum.ranking.metric",
              "threshold.metric": "__search__.enum.threshold.metric",
              "threshold.value": "__search__.enum.threshold.value",
              "width": "__search__.enum.width"
            }
          }
        }
      ],
      "flows": [],
      "mangled_name": "test",
      "name": "test",
      "return": null,
      "search": {
        "queue": {
          "metric": "__search__.queue.metric",
          "stop": "__search__.queue.stop"
        }
      }
    }
  },
  "records": {
    "Status": {
      "desc": [],
      "fields": [
        {
          "depth": 1,
          "desc": [],
          "format": {
            "type": "enum",
            "values": [
              "pending",
              "active",
              "done"
            ]
          },
          "index": 0,
          "name": "Status",
          "range": null
        }
      ],
      "name": "Status"
    }
  }
}
