{
  "defines": {},
  "entry_points": {
    "main": "source"
  },
  "prompts": {
    "consumer": {
      "channels": [
        {
          "clauses": [
            {
              "target": [
                {
                  "name": "secret"
                }
              ],
              "type": "prune"
            }
          ],
          "prompt": "source",
          "source": [
            {
              "name": "result"
            }
          ],
          "target": {
            "is_input": false,
            "prompt": null,
            "steps": [
              {
                "name": "data"
              }
            ]
          },
          "type": "dataflow"
        }
      ],
      "context": {},
      "desc": [],
      "fields": [
        {
          "depth": 1,
          "desc": [],
          "format": {
            "fields": [
              {
                "depth": 2,
                "desc": [],
                "format": {
                  "length": 10,
                  "type": "completion"
                },
                "index": 0,
                "name": "name",
                "range": null,
                "search": {
                  "text": {
                    "ahead": "__search__.text.ahead",
                    "beams": "__search__.text.beams",
                    "diversity": "__search__.text.diversity",
                    "repetition": "__search__.text.repetition",
                    "threshold": "__search__.text.threshold",
                    "topk": "__search__.text.topk",
                    "width": "__search__.text.width"
                  }
                }
              },
              {
                "depth": 2,
                "desc": [],
                "format": {
                  "length": 10,
                  "type": "completion"
                },
                "index": 1,
                "name": "value",
                "range": null,
                "search": {
                  "text": {
                    "ahead": "__search__.text.ahead",
                    "beams": "__search__.text.beams",
                    "diversity": "__search__.text.diversity",
                    "repetition": "__search__.text.repetition",
                    "threshold": "__search__.text.threshold",
                    "topk": "__search__.text.topk",
                    "width": "__search__.text.width"
                  }
                }
              }
            ],
            "type": "struct"
          },
          "index": 0,
          "name": "data",
          "range": null
        },
        {
          "depth": 1,
          "desc": [],
          "format": {
            "length": 20,
            "type": "completion"
          },
          "index": 1,
          "name": "answer",
          "range": null,
          "search": {
            "text": {
              "ahead": "__search__.text.ahead",
              "beams": "__search__.text.beams",
              "diversity": "__search__.text.diversity",
              "repetition": "__search__.text.repetition",
              "threshold": "__search__.text.threshold",
              "topk": "__search__.text.topk",
              "width": "__search__.text.width"
            }
          }
        }
      ],
      "flows": [],
      "mangled_name": "consumer",
      "name": "consumer",
      "return": {
        "fields": [
          {
            "alias": null,
            "clauses": [],
            "source": {
              "is_input": false,
              "prompt": null,
              "steps": [
                {
                  "name": "answer"
                }
              ]
            }
          }
        ],
        "label": null
      },
      "search": {
        "queue": {
          "metric": "__search__.queue.metric",
          "stop": "__search__.queue.stop"
        }
      }
    },
    "source": {
      "channels": [
        {
          "source": [
            {
              "name": "query"
            }
          ],
          "target": {
            "is_input": false,
            "prompt": null,
            "steps": [
              {
                "name": "query"
              }
            ]
          },
          "type": "input"
        }
      ],
      "context": {},
      "desc": [],
      "fields": [
        {
          "depth": 1,
          "desc": [],
          "format": {
            "length": 10,
            "type": "completion"
          },
          "index": 0,
          "name": "query",
          "range": null,
          "search": {
            "text": {
              "ahead": "__search__.text.ahead",
              "beams": "__search__.text.beams",
              "diversity": "__search__.text.diversity",
              "repetition": "__search__.text.repetition",
              "threshold": "__search__.text.threshold",
              "topk": "__search__.text.topk",
              "width": "__search__.text.width"
            }
          }
        },
        {
          "depth": 1,
          "desc": [],
          "format": {
            "fields": [
              {
                "depth": 2,
                "desc": [],
                "format": {
                  "length": 10,
                  "type": "completion"
                },
                "index": 0,
                "name": "name",
                "range": null,
                "search": {
                  "text": {
                    "ahead": "__search__.text.ahead",
                    "beams": "__search__.text.beams",
                    "diversity": "__search__.text.diversity",
                    "repetition": "__search__.text.repetition",
                    "threshold": "__search__.text.threshold",
                    "topk": "__search__.text.topk",
                    "width": "__search__.text.width"
                  }
                }
              },
              {
                "depth": 2,
                "desc": [],
                "format": {
                  "length": 10,
                  "type": "completion"
                },
                "index": 1,
                "name": "secret",
                "range": null,
                "search": {
                  "text": {
                    "ahead": "__search__.text.ahead",
                    "beams": "__search__.text.beams",
                    "diversity": "__search__.text.diversity",
                    "repetition": "__search__.text.repetition",
                    "threshold": "__search__.text.threshold",
                    "topk": "__search__.text.topk",
                    "width": "__search__.text.width"
                  }
                }
              },
              {
                "depth": 2,
                "desc": [],
                "format": {
                  "length": 10,
                  "type": "completion"
                },
                "index": 2,
                "name": "value",
                "range": null,
                "search": {
                  "text": {
                    "ahead": "__search__.text.ahead",
                    "beams": "__search__.text.beams",
                    "diversity": "__search__.text.diversity",
                    "repetition": "__search__.text.repetition",
                    "threshold": "__search__.text.threshold",
                    "topk": "__search__.text.topk",
                    "width": "__search__.text.width"
                  }
                }
              }
            ],
            "type": "struct"
          },
          "index": 1,
          "name": "result",
          "range": null
        }
      ],
      "flows": [
        {
          "label": null,
          "limit": null,
          "target": "consumer"
        }
      ],
      "mangled_name": "source",
      "name": "source",
      "return": null,
      "search": {
        "queue": {
          "metric": "__search__.queue.metric",
          "stop": "__search__.queue.stop"
        }
      }
    }
  },
  "records": {}
}
