{
  "defines": {},
  "entry_points": {
    "worker": "worker"
  },
  "prompts": {
    "worker": {
      "channels": [],
      "context": {},
      "desc": [],
      "fields": [
        {
          "depth": 1,
          "desc": [],
          "format": {
            "type": "completion"
          },
          "index": 0,
          "name": "out",
          "range": null,
          "search": {
            "text": {
              "ahead": "__search__.text.ahead",
              "beams": "__search__.text.beams",
              "diversity": "__search__.text.diversity",
              "repetition": "__search__.text.repetition",
              "threshold": "__search__.text.threshold",
              "topk": "__search__.text.topk",
              "width": "__search__.text.width"
            }
          }
        }
      ],
      "flows": [],
      "mangled_name": "worker",
      "name": "worker",
      "return": null,
      "search": {
        "queue": {
          "metric": "__search__.queue.metric",
          "stop": "__search__.queue.stop"
        }
      }
    }
  },
  "records": {}
}
