{
  "defines": {},
  "entry_points": {
    "main": "thinker"
  },
  "prompts": {
    "thinker": {
      "channels": [
        {
          "source": [
            {
              "name": "problem"
            }
          ],
          "target": {
            "is_input": false,
            "prompt": null,
            "steps": [
              {
                "name": "problem"
              }
            ]
          },
          "type": "input"
        },
        {
          "source": [
            {
              "name": "reflection"
            }
          ],
          "target": {
            "is_input": false,
            "prompt": null,
            "steps": [
              {
                "name": "hint"
              }
            ]
          },
          "type": "input"
        }
      ],
      "context": {},
      "desc": [],
      "fields": [
        {
          "depth": 1,
          "desc": [],
          "format": {
            "type": "completion"
          },
          "index": 0,
          "name": "problem",
          "range": null,
          "search": {
            "text": {
              "ahead": "__search__.text.ahead",
              "beams": "__search__.text.beams",
              "diversity": "__search__.text.diversity",
              "repetition": "__search__.text.repetition",
              "threshold": "__search__.text.threshold",
              "topk": "__search__.text.topk",
              "width": "__search__.text.width"
            }
          }
        },
        {
          "depth": 1,
          "desc": [],
          "format": {
            "type": "completion"
          },
          "index": 1,
          "name": "hint",
          "range": null,
          "refname": "Hint",
          "search": {
            "text": {
              "ahead": "__search__.text.ahead",
              "beams": "__search__.text.beams",
              "diversity": "__search__.text.diversity",
              "repetition": "__search__.text.repetition",
              "threshold": "__search__.text.threshold",
              "topk": "__search__.text.topk",
              "width": "__search__.text.width"
            }
          }
        },
        {
          "depth": 1,
          "desc": [],
          "format": {
            "type": "completion"
          },
          "index": 2,
          "name": "solution",
          "range": null,
          "search": {
            "text": {
              "ahead": "__search__.text.ahead",
              "beams": "__search__.text.beams",
              "diversity": "__search__.text.diversity",
              "repetition": "__search__.text.repetition",
              "threshold": "__search__.text.threshold",
              "topk": "__search__.text.topk",
              "width": "__search__.text.width"
            }
          }
        },
        {
          "depth": 1,
          "desc": [],
          "format": {
            "type": "completion"
          },
          "index": 3,
          "name": "reflection",
          "range": null,
          "refname": "Hint",
          "search": {
            "text": {
              "ahead": "__search__.text.ahead",
              "beams": "__search__.text.beams",
              "diversity": "__search__.text.diversity",
              "repetition": "__search__.text.repetition",
              "threshold": "__search__.text.threshold",
              "topk": "__search__.text.topk",
              "width": "__search__.text.width"
            }
          }
        }
      ],
      "flows": [],
      "mangled_name": "thinker",
      "name": "thinker",
      "return": {
        "fields": [
          {
            "alias": null,
            "clauses": [],
            "source": {
              "is_input": false,
              "prompt": null,
              "steps": [
                {
                  "name": "solution"
                }
              ]
            }
          }
        ],
        "label": null
      },
      "search": {
        "queue": {
          "metric": "__search__.queue.metric",
          "stop": "__search__.queue.stop"
        }
      }
    }
  },
  "records": {
    "Hint": {
      "desc": [],
      "fields": [
        {
          "depth": 1,
          "desc": [],
          "format": {
            "type": "completion"
          },
          "index": 0,
          "name": "Hint",
          "range": null
        }
      ],
      "name": "Hint"
    }
  }
}
